"AssemblyFileName","ClassName","Target","Severity","ProblemId","Description","Remediation"
"C:\azure-powershell\src\Package\Debug\ResourceManager\AzureResourceManager\AzureRM.RecoveryServices\Microsoft.Azure.Commands.RecoveryServices.ARM.dll","Microsoft.Azure.Commands.RecoveryServices.GetAzureRmRecoveryServicesVaultSettingsFile","Get-AzureRmRecoveryServicesVaultSettingsFile","1","8510","Cmdlet 'Get-AzureRmRecoveryServicesVaultSettingsFile' has multiple parameter sets, but no defined default parameter set.","Define a default parameter set in the cmdlet attribute."
"C:\azure-powershell\src\Package\Debug\ResourceManager\AzureResourceManager\AzureRM.RecoveryServices\Microsoft.Azure.Commands.RecoveryServices.ARM.dll","Microsoft.Azure.Commands.RecoveryServices.SetAzureRmRecoveryServicesBackupProperties","Set-AzureRmRecoveryServicesBackupProperties","1","8400","Set-AzureRmRecoveryServicesBackupProperties uses the noun 'AzureRmRecoveryServicesBackupProperties', which does not follow the enforced naming convention of using a singular noun for a cmdlet name.","Consider using a singular noun for the cmdlet name."
"C:\azure-powershell\src\Package\Debug\ResourceManager\AzureResourceManager\AzureRM.RecoveryServices\Microsoft.Azure.Commands.RecoveryServices.ARM.dll","Microsoft.Azure.Commands.RecoveryServices.SetAzureRmRecoveryServicesBackupProperties","Set-AzureRmRecoveryServicesBackupProperties","1","8600","Cmdlet 'Set-AzureRmRecoveryServicesBackupProperties' has no defined output type.","Add an OutputType attribute that declares the type of the object(s) returned by this cmdlet. If this cmdlet returns no output, please set the output type to 'bool' and make sure to implement the 'PassThru' parameter."
"C:\azure-powershell\src\Package\Debug\ResourceManager\AzureResourceManager\AzureRM.RecoveryServices\Microsoft.Azure.Commands.RecoveryServices.ARM.dll","Microsoft.Azure.Commands.RecoveryServices.Backup.Cmdlets.SetAzureRmRecoveryServicesVaultContext","Set-AzureRmRecoveryServicesVaultContext","1","8100","Set-AzureRmRecoveryServicesVaultContext Does not support ShouldProcess but the cmdlet verb Set indicates that it should.","Determine if the cmdlet should implement ShouldProcess and if so determine if it should implement Force / ShouldContinue"
"C:\azure-powershell\src\Package\Debug\ResourceManager\AzureResourceManager\AzureRM.RecoveryServices\Microsoft.Azure.Commands.RecoveryServices.ARM.dll","Microsoft.Azure.Commands.RecoveryServices.Backup.Cmdlets.SetAzureRmRecoveryServicesVaultContext","Set-AzureRmRecoveryServicesVaultContext","1","8600","Cmdlet 'Set-AzureRmRecoveryServicesVaultContext' has no defined output type.","Add an OutputType attribute that declares the type of the object(s) returned by this cmdlet. If this cmdlet returns no output, please set the output type to 'bool' and make sure to implement the 'PassThru' parameter."
