"Module","ClassName","Target","Severity","ProblemId","Description","Remediation"
"Microsoft.Azure.PowerShell.Cmdlets.StorageSync.dll","Microsoft.Azure.Commands.StorageSync.Evaluation.Cmdlets.InvokeCompatibilityCheckCmdlet","Invoke-AzStorageSyncCompatibilityCheck","1","8100","Invoke-AzStorageSyncCompatibilityCheck Does not support ShouldProcess but the cmdlet verb Invoke indicates that it should.","Determine if the cmdlet should implement ShouldProcess and if so determine if it should implement Force / ShouldContinue"
"Microsoft.Azure.PowerShell.Cmdlets.StorageSync.dll","Microsoft.Azure.Commands.StorageSync.Evaluation.Cmdlets.InvokeCompatibilityCheckCmdlet","Invoke-AzStorageSyncCompatibilityCheck","1","8410","Parameter SkipNamespaceChecks of cmdlet Invoke-AzStorageSyncCompatibilityCheck does not follow the enforced naming convention of using a singular noun for a parameter name.","Consider using a singular noun for the parameter name."
"Microsoft.Azure.PowerShell.Cmdlets.StorageSync.dll","Microsoft.Azure.Commands.StorageSync.Evaluation.Cmdlets.InvokeCompatibilityCheckCmdlet","Invoke-AzStorageSyncCompatibilityCheck","1","8410","Parameter SkipSystemChecks of cmdlet Invoke-AzStorageSyncCompatibilityCheck does not follow the enforced naming convention of using a singular noun for a parameter name.","Consider using a singular noun for the parameter name."
"Microsoft.Azure.PowerShell.Cmdlets.StorageSync.dll","Microsoft.Azure.Commands.StorageSync.Cmdlets.NewServerEndpointCommand","New-AzStorageSyncServerEndpoint","1","8410","Parameter TierFilesOlderThanDays of cmdlet New-AzStorageSyncServerEndpoint does not follow the enforced naming convention of using a singular noun for a parameter name.","Consider using a singular noun for the parameter name."
"Microsoft.Azure.PowerShell.Cmdlets.StorageSync.dll","Microsoft.Azure.Commands.StorageSync.Cmdlets.SetServerEndpointCommand","Set-AzStorageSyncServerEndpoint","1","8410","Parameter TierFilesOlderThanDays of cmdlet Set-AzStorageSyncServerEndpoint does not follow the enforced naming convention of using a singular noun for a parameter name.","Consider using a singular noun for the parameter name."